<!ENTITY % block "codeblock | ol | p | ul" >
<!ENTITY % inline "#PCDATA | code | strong | em | filename | link | varlink | tt | quote | xref" >

<!ENTITY fink_version "0.9.0" >
<!ENTITY fink_tool_version "0.45.4">


<!-- Root elements -->
<!ELEMENT article ( title, shorttitle, cvsid, preface?, section+ ) >
<!ATTLIST article filename ID #REQUIRED >
<!ATTLIST article lang CDATA "en" >
<!ATTLIST article fsroot CDATA "../" >

<!ELEMENT document ( title, shorttitle, cvsid, preface?, chapter+ ) >
<!ATTLIST document filename ID #REQUIRED >
<!ATTLIST document lang CDATA "en" >
<!ATTLIST document section CDATA "documentation" >
<!ATTLIST document fsroot CDATA "../../" >


<!-- Structure -->
<!ELEMENT chapter ( title, shorttitle, preface?, section+ ) >
<!ATTLIST chapter filename ID #REQUIRED >

<!ELEMENT title ( #PCDATA ) >
<!ELEMENT shorttitle ( #PCDATA ) >
<!ELEMENT cvsid ( #PCDATA ) >
<!ELEMENT preface ( p+ ) >

<!ELEMENT section (title?, ( %block; | itemtable )*) >
<!ATTLIST section name NMTOKEN #IMPLIED >
<!ATTLIST section translated (yes|no) "yes" >


<!-- Block elements -->
<!ELEMENT codeblock ( #PCDATA | em | strong )* >
<!ELEMENT p ( %inline; )* >
<!ATTLIST p translated (yes|no) "yes" >


<!-- Inline -->
<!ELEMENT code ( #PCDATA | em | strong )* >
<!ELEMENT em ( #PCDATA ) >
<!ELEMENT strong ( #PCDATA ) >
<!ELEMENT filename ( #PCDATA ) >
<!ELEMENT tt ( #PCDATA ) >
<!ELEMENT quote ( #PCDATA ) >


<!-- Links -->
<!ELEMENT link ( #PCDATA ) >
<!ATTLIST link url CDATA #REQUIRED >

<!-- VarLinks -->
<!ELEMENT varlink ( #PCDATA ) >
<!ATTLIST varlink url CDATA #REQUIRED >
<!ATTLIST varlink varurl CDATA #REQUIRED >


<!ELEMENT xref ( #PCDATA ) >
<!ATTLIST xref chapter IDREF #IMPLIED >
<!ATTLIST xref section NMTOKEN #IMPLIED >


<!-- Lists -->
<!ELEMENT ol ( li+ ) >
<!ELEMENT ul ( li+ ) >

<!ELEMENT li ( %inline; | codeblock | p | ol )* >

<!ELEMENT itemtable ( item+ ) >
<!ATTLIST itemtable labeld CDATA "Value" >
<!ATTLIST itemtable labelt CDATA "Field" >

<!ELEMENT item ( itemt, itemd ) >
<!ELEMENT itemt ( %inline; )* >
<!ELEMENT itemd ( %block; )* >
