<?xml version="1.0" encoding="UTF-8"?>
<!DOCTYPE article SYSTEM "../finkdoc.dtd">
<article filename="index" lang="en">
  <title>Fink - Documentation</title>
  <shorttitle>Documentation</shorttitle>
  <cvsid>$Id: doc.en.xml,v 1.20 2019/01/19 10:11:12 nieder Exp $</cvsid>
  <preface>
    <p>
This is a collection of various documents written for Fink.
Some of the documents may also be useful to people who use Mac OS X
or Darwin without Fink and want to learn about porting Unix software.
</p>
  </preface>
  <section name="userdoc">
    <title>User Documentation</title>
    <p>
The current user documentation for Fink:
</p>
    <ul>
      <li><varlink url="users-guide/index.php" varurl="users-guide/uguide.en.html">Fink User's Guide</varlink> -
this covers installing Fink itself, installing packages, and upgrading
to a new Fink release. It contains instructions for both the source
and the binary release.
</li>
      <li><varlink url="advanced/index.php" varurl="advanced/advanced.en.html">Fink Advanced Topics Guide</varlink> -
covers more advanced concepts than those covered in the User's Guide.</li>
      <li><varlink url="x11/index.php" varurl="x11/x11.en.html">Running X11 on Darwin and Mac OS X</varlink> -
covers concepts, installation and launching (also intended for Darwin
and Mac OS X users in general)</li>
    </ul>
    <p>
A bunch of documents that are more complete, but slightly outdated and
no longer maintained:
</p>
    <ul>
      <li><varlink url="install/index.php" varurl="install/install.en.html">Installation and Upgrading</varlink> - how
to install Fink or upgrade to a new version</li>
      <li><varlink url="usage/index.php" varurl="usage/usage.en.html">Usage</varlink> - how to use Fink
and the installed software</li>
      <li><varlink url="readme.php" varurl="readme.en.html">Fink ReadMe</varlink> - the ReadMe for the
source distribution</li>
      <li><varlink url="gitaccess/index.php" varurl="gitaccess/git.en.html">Git Access</varlink> - how to access the
Fink Git repository to get the latest source packages between
releases</li>
    </ul>
  </section>
  <section name="developerdoc">
    <title>Developer Documentation</title>
    <ul>
      <li><varlink url="security/index.php" varurl="security/sec-policy.en.html">Security Policy Manual</varlink> - 
	  Mandatory read for all of those who either maintain packages in Fink or would like to add their own.</li>
      <li><link url="/doc/UsingFink.pdf">Using Fink: A Developer's How To</link> (2MB pdf
file) - slides from a presentation at the <link url="http://conferences.oreillynet.com/macosx2002/">O'Reilly Mac OS X Conference</link> (also available as a
<link url="http://conferences.oreillynet.com/presentations/macosx02/morrison_david.ppt">PowerPoint file</link>) </li>
      <li><varlink url="porting/index.php" varurl="porting/porting.en.html">Porting Tips</varlink> - notes for porting
Unix applications to Darwin</li>
      <li><varlink url="quick-start-pkg/index.php" varurl="quick-start-pkg/quick-start-pkg.en.html">Packaging Tutorial</varlink> - a complement to the Packaging Manual which focuses on real examples and introduces packaging to beginners.</li>
      <li><varlink url="packaging/index.php" varurl="packaging/packaging.en.html">Packaging Manual</varlink> - how to create and
maintain Fink packages</li>
      <li><link url="http://wiki.finkproject.org/index.php/Fink">The Fink Developer Wiki</link> - includes developer-related material that is under construction.</li>
    </ul>
  </section>
  <section name="otherdoc">
    <title>Other Documents</title>
    <ul>
      <li><varlink url="multilingual/index.php" varurl="multilingual/multilingual.en.html">Internationalization Guide</varlink> - material concerning
the ongoing website
internationalization 
effort</li>
      <li><varlink url="netiquette/index.php" varurl="netiquette/netiquette.en.html">Mailing List Netiquette</varlink> - how best to employ the Fink mailing lists.</li>
    </ul>
  </section>
</article>
