<?xml version="1.0" encoding="UTF-8"?>
<!DOCTYPE document SYSTEM "../finkdoc.dtd">
<document filename="index" lang="es">
  <title>Como mandar mensajes a las Listas de Correo de Fink</title>
  <shorttitle>Netiquette</shorttitle>
  <cvsid>$Id: netiquette.es.xml,v 1.5 2023/08/04 5:23:15 nieder Exp $</cvsid>
  <preface>
    <p><em>Este es un documento en construcción.</em></p>
    <p>Este documento pretende ser una guía para los nuevos miembros de las Listas de 
    Correo de Fink. La idea principal es indicar a los usuarios como mandar mensajes efectivamente, con el fin de solucionar efectivamente cualquier problema. </p>
    <p>Usted puede haber sido mandado a esta página en respuesta a algún mensaje. Por favor, no se ofenda. Lo más posible es que es necesario que provee más información con el objeto de aclarar la causa de su problema, y que dicha información se encuentre listada aquí.</p>
  </preface>
  <chapter filename="before-post">
    <title>¿Qué hacer antes de 'postear'?</title>
    <shorttitle>Antes de 'Postear'</shorttitle>
    <section name="research">
      <title>Investige su pregunta. </title>
      <p>Siempre es importante hacer algo de investigación antes de postear, dado que es posible que ya se haya dado una respuesta a su pregunta. Algunos ejemplos de los lugares donde buscar son:</p>
      <ul>
        <li>la documentación en línea</li>
        <li>los archivos de la lista de correo</li>
        <li>Google</li>
      </ul>
    </section>
  </chapter>
  <chapter filename="first-post">
    <title>Primer "Post"</title>
    <shorttitle>Inicial</shorttitle>
    <section name="system">
      <title>¿Qué has instalado?</title>
      <p>Si has estado teniendo problemas con un paquete instalado, deberás proveer la siguiente información acerca de tu sistema:</p>
      <ul>
        <li>Tu versión de OS.</li>
        <li>La versión de Fink que estás usando.  Un tip útil es ejecutar el comando <codeblock>fink --version</codeblock>en una ventana de terminal y adicionar el resultado a tu información en el "post".</li>
        <li>También deberás especificar si estas instalando a partir de binarios, e.g. usando <code>apt-get</code>, o de la fuenta, e.g. usando <code>fink install</code>.<p>En el segundo caso, favor de indicar la versión de las Developer Tools que estas usando.</p></li>
        <li><p>Si estas instalando un paquete que requiere de X11, deberás indicar si estas usando:  Apple's X11 o XFree86.  En el segundo caso, especifica la versión.   </p><p>Si tienes dudas, provee toda la informacion arriba mencionada.</p></li>
      </ul>
    </section>
    <section name="problem-description">
      <title>¿Qué es lo que esta mal?</title>
      <ul>
        <li><em>Especifica el nombre y la vbersión del paquete que esta causando 
        problemas.</em>  <p>Este dato debera estar en la línes del tema de tu mensaje.
        </p><p>Esto significa que si estas teniendo problemas con <code>foo-3.141-6
        </code>, no solo reportes un problema con <code>foo</code>.</p><p>En particular,
        si estás instalando un paquete (e.g. <code>baz-2.18-1</code>) que depende de 
        otros paquetes, (<code>foo-3.141-6</code>, <code>bar-16.0-9</code>, ...) , y 
        estás teniendo problemas con <code>foo</code>, deberás reportar un problema con 
        <code>foo-3.141-6</code>, no con <code>baz-2.18-1</code>.</p></li>
        <li><em>Describe el problema.</em>  
        <p>Esto significa que deberás "postear" una muestra del mensaje de error que 
        estes recibiendo.</p><ol>
            <li>En el caso de problemas con la instalación de binarios, comienza
            donde esta siendo desempaquetado en paquete problematico:
            <codeblock>...
Selecting previously deselected package foo
error unpacking foo
...</codeblock>y continua hasta el final.<p></p></li>
            <li>Hay pocas posibilidades de problemas con la instalacion desde la fuente:
            <ol>
                <li>Si el error es durante la configuración inicial, el error ocurrirá 
                desde el principio. "Postea" desde el último grupo de pruebas que se 
                ejecutaron justo antes del mensaje de error hasta después de dicho 
                mensaje:<codeblock>....
Checking for bar-config...no
Error:  bar-config not found
....</codeblock><p>Si crees que el dato puede ayudar, entonces puedes "postear" la sección relevante del log del archivo de configuración, e.g. <filename>/opt/sw/src/foo-3.141-6/foo-3.141/config.log</filename>.  <em>Por favor, no pongas TODO el archivo, podría se bastante grande.</em></p></li>
                <li>O, el error puede aparecer hasta que se inicía la construcción del
                paquete. En este caso, "postea" la última línea que el compilador trato 
                de ejecutar hasta el mensaje de error:<codeblock>...
gcc &lt;flags, files etc.&gt;
&lt;error messages&gt;
...</codeblock></li>
                <li>Sí lo que obtienes es el temido error de <code>execution of mv failed</code> lo que habrás de hacer es buscar en el output del build un error previó,
                 así que mejor buscaló antes de hacer tu "post".</li>
              </ol></li>
          </ol>    </li>
      </ul>
    </section>
    <section name="remedies">
      <title>¿Qué has intentado?</title>
      <p>Es una buena idea mencionar que cosas has intentado para corregir la 
      situación, e.g.</p>
      <ul>
        <li>Instructiones en el FAQ u otra documentación</li>
        <li>La remoción de los paquetes que parecen causar conflicto</li>
        <li>Reconstrucciones/reinstalaciones</li>
        <li>La actualización de las descripciones de los paquetes</li>
        <li>etc.</li>
      </ul>
      <p>De esta manera, nadie empezará a sugerir cosas que ya intentaste.</p>
    </section>
    <section name="future-plans">
      <title>¿Qué intentarás ahora?</title>
      <p>Algunas cosas caen en esta categoría:</p>
      <ul>
        <li>"Postea" lo que planeas hacer en caso de no obtener respuesta inmediata.</li>
        <li>Preguntar acerca de lo apropiado del curso de acción elegido.</li>
      </ul>
    </section>
  </chapter>
  <chapter filename="reply">
    <title>Respondiendo a los "posts"</title>
    <shorttitle>Respondiendo</shorttitle>
    <preface>
      <p>Este capítulo cubre como responder a los "posts".</p>
    </preface>
    <section name="reply-to-list">
      <title>Asegurate de responder a la Lista.</title>
      <p>A diferencia de otras listas a las que estes suscrito, las Listas del Fink
      están ajustadas para que si respondes a un mensaje, la respuesta llega a quien puso el mensaje, pero <em>no</em> a la lista.  Por favor, asegurate de responder a la lista, así:  </p>
      <ul>
        <li>Más gente verá tu problema.</li>
        <li>No monopolizaras el tiempo de nadie. Recuerda que la gente que responde a las listas son voluntarios.</li>
        <li>Otras pueden beneficiarse. El tener un set completo de intercambio de correo a la vista del público significa que este set irá al archivo de la lista de correo y finalmente a la documentación.</li>
      </ul>
      <p>Frecuentemente se usa el comando <quote>Reply to All</quote> para lograr ésto:</p>
      <ul>
        <li>Es igual de facil que ejecutar "Reply".</li>
        <li>Aunque esto manda el mensaje tanto a lista como al autor de mensaje previo, esta opción es preferida dado que en ocasiones la lista se retrasa, e.g. al filtrar correos durante las epidemias, pero el mensaje le llegará al destinatario pronto.</li>
      </ul>
      <p>Claro que si haces esto, tal vez quieras eliminar algunos destinatarios extra 
      (por ejemplo, de post cruzados, u otras personas que ya hayan respondido).</p>
    </section>
  </chapter>
  <chapter filename="unsubscribe">
    <title>¿Cómo desuscribirse de las Listas?</title>
    <shorttitle>Desuscripción</shorttitle>
    <section name="unsubscribing">
      <title>¿Cómo me desuscribo?</title>
      <p>Para desuscribirse, <em>no</em> mande un mensaje a la lista.</p>
      <ol>
        <li>Vaya a la página de las<link url="/lists/index.php">Listas de Correo</link>.  <p>Nota:  no use el Internet Explorer del MacOS X.</p></li>
        <li>Seleccione el vínculo de la lista de la que desea desuscribirse.</li>
        <li>Vaya al pie de la página donde dice::  <quote>Para cambiar su suscripción (ajustar opciones como resumen y modos de entrega, obtener un recordatorio de tu password o desuscribirse), ingrese su dirección de correo suscrito:</quote>, e ingrese la dirección de correo electrónico donde esta recibiendo el correo de Fink, entonces dele click al botón de <quote>Edit Options</quote> .   </li>
        <li>En la página que se abre a continuación, hay un campo en la parte superior 
        izquierda donde se puede desuscribir.</li>
      </ol>
    </section>
  </chapter>
</document>
