<?xml version="1.0" encoding="utf-8"?>
<!DOCTYPE article SYSTEM "../finkdoc.dtd">

<article filename="index" lang="ja" >
<title>Fink - Documentation</title>
<shorttitle>Documentation</shorttitle>
<cvsid>$Id: doc.ja.xml,v 1.22 2019/01/19 10:11:12 nieder Exp $</cvsid>

<preface>
<p>
このページは、 Fink 用に書かれたドキュメントの一覧です。
ドキュメントの中には、 Fink を使わずに Mac OS X や Darwin だけを使う人、 Unix ソフトウェアのポートの仕方を知りたい人にも有用な情報もあります。
</p>
</preface>

<section name="userdoc"><title>ユーザー向けドキュメント</title>

<p>
現在のユーザー向け Fink ドキュメント:
</p>
<ul>
<li><varlink url="users-guide/index.php" varurl="users-guide/uguide.ja.html">Fink ユーザーガイド</varlink> -
Fink 本体のインストール、パッケージのインストール、新しい Fink リリースへのアップグレードなどが書かれています。
ソースとバイナリリリースの両方の説明が書かれています
</li>
<li><varlink url="advanced/index.php" varurl="advanced/advanced.en.html">Fink 上級者向けトピックガイド</varlink> -
ユーザーガイドよりも上級者向けのトピックをカバーしています</li>
<li><varlink url="x11/index.php" varurl="x11/x11.ja.html">Darwin と Mac OS X での X11</varlink> -
コンセプト、インストール、起動について書かれています (一般的な Darwin と Mac OS X ユーザー向け) </li>
</ul>

<p>
以下のドキュメントはより詳細ですが、内容が多少古くなっている上、今後メンテナンスされません。
（訳注 日本語版はありません）:
</p>
<ul>
<li><varlink url="install/index.php" varurl="install/install.en.html">Installation and Upgrading</varlink> - how
to install Fink or upgrade to a new version</li>
<li><varlink url="usage/index.php" varurl="usage/usage.en.html">Usage</varlink> - how to use Fink
and the installed software</li>
<li><varlink url="readme.php" varurl="readme.ja.html">Fink ReadMe</varlink> - the ReadMe for the
source distribution</li>
<li><varlink url="gitaccess/index.php" varurl="gitaccess/git.en.html">Git Access</varlink> - how to access the
Fink Git repository to get the latest source packages between
releases</li>
</ul>

</section>

<section name="developerdoc"><title>開発者向けドキュメント</title>

<ul>
<li><varlink url="security/index.php" varurl="security/sec-policy.ja.html">セキュリティーポリシー</varlink> - 
Fink のパッケージをメンテナンスしている人、したいと思っている人、必見</li>
<li><link url="/doc/UsingFink.pdf">Using Fink: A Developer's How To</link> (2MB pdf
file) - <link
url="http://conferences.oreillynet.com/macosx2002/"
>O'Reilly Mac OS X Conference</link> でのプレゼンテーション用スライド (
<link url="http://conferences.oreillynet.com/presentations/macosx02/morrison_david.ppt">PowerPoint ファイル</link> もあります) </li>
<li><varlink url="porting/index.php" varurl="porting/porting.en.html">Porting Tips</varlink> - 
Unix アプリケーションを Darwin へポートする際に有用な情報</li>
<li><varlink url="quick-start-pkg/index.php" varurl="quick-start-pkg/quick-start-pkg.en.html">パッケージ化チュートリアル</varlink> - 
パッケージ化マニュアルへにない、実例を用いた初心者向け紹介文書</li>
<li><varlink url="packaging/index.php" varurl="packaging/packaging.en.html">パッケージ化マニュアル</varlink> - 
Fink パッケージの作り方、メンテナンス方法</li>
<li><link url="http://wiki.finkproject.org/index.php/Fink">The Fink Developer Wiki</link> - 作成途中の開発に関連する資料など</li>
</ul>
</section>
<section name="otherdoc">
<title>Other Documents</title>
<ul>
<li><varlink url="multilingual/index.php" varurl="multilingual/multilingual.en.html">国際化ガイド</varlink> - 
現在進行中のウェブサイト国際化に関するドキュメント</li>
<li><varlink url="netiquette/index.php" varurl="netiquette/netiquette.en.html">メーリングリスト投稿時の注意</varlink> - 
メーリングリストを快適に保つために</li>
</ul>
</section>
</article>
